{
  "$schema": "https://geocontract.dev/schemas/activity-concept-catalog.schema.json",
  "version": "1.0.0",
  "publishedAt": "2026-09-12",
  "publisher": "geocontract",
  "description": "Hand-curated v1.0 catalog of ActivityConcept rows used to validate the `activity.code` field on a ProposedAction. The federal CATEX catalogue (https://ce.permitting.innovation.gov/data/exclusions.json) is consumed strictly as one source citation per row; this catalog does not endorse, exempt, or approve any activity for any specific proposal, parcel, applicant, or jurisdiction.",
  "regulatoryStatusEnum": ["descriptive_only", "jurisdictional_advisory", "deprecated"],
  "lifecycleStatusEnum": ["active", "candidate", "retired", "superseded"],
  "concepts": [
    {
      "code": "housing.rehabilitation.facade",
      "preferredLabel": "Building fa\u00e7ade rehabilitation",
      "definition": "Repair, repoint, or replace the exterior fa\u00e7ade of a residential building, including lintels, cornices, and decorative elements.",
      "broader": ["housing.rehabilitation"],
      "narrower": ["housing.rehabilitation.facade.repointing", "housing.rehabilitation.facade.lintel_replacement"],
      "aliases": ["facade repair", "masonry repointing", "lintel replacement"],
      "jurisdiction": null,
      "sourceCitation": "https://ce.permitting.innovation.gov/data/exclusions.json",
      "lifecycleStatus": "active",
      "deprecatedAfter": null,
      "regulatoryStatus": "descriptive_only"
    },
    {
      "code": "housing.rehabilitation.facade.repointing",
      "preferredLabel": "Mortar repointing",
      "definition": "Replacement of failed mortar joints in masonry walls without altering the wall's structural fabric.",
      "broader": ["housing.rehabilitation.facade"],
      "narrower": [],
      "aliases": ["repointing", "tuckpointing"],
      "jurisdiction": null,
      "sourceCitation": null,
      "lifecycleStatus": "active",
      "deprecatedAfter": null,
      "regulatoryStatus": "descriptive_only"
    },
    {
      "code": "housing.rehabilitation.facade.lintel_replacement",
      "preferredLabel": "Lintel replacement",
      "definition": "Replacement of steel or stone lintels above window or door openings in a residential building.",
      "broader": ["housing.rehabilitation.facade"],
      "narrower": [],
      "aliases": ["lintel replacement", "header replacement"],
      "jurisdiction": null,
      "sourceCitation": null,
      "lifecycleStatus": "active",
      "deprecatedAfter": null,
      "regulatoryStatus": "descriptive_only"
    },
    {
      "code": "housing.rehabilitation.roof",
      "preferredLabel": "Roof rehabilitation",
      "definition": "Repair or replacement of the roof covering, sheathing, flashing, gutters, or soffits of a residential building.",
      "broader": ["housing.rehabilitation"],
      "narrower": [],
      "aliases": ["roof repair", "reroof", "roofing"],
      "jurisdiction": null,
      "sourceCitation": "https://ce.permitting.innovation.gov/data/exclusions.json#catex.HUD.24CFR50.4",
      "lifecycleStatus": "active",
      "deprecatedAfter": null,
      "regulatoryStatus": "descriptive_only"
    },
    {
      "code": "housing.rehabilitation.foundation",
      "preferredLabel": "Foundation repair",
      "definition": "Repair or stabilisation of an existing building's foundation, including crack injection, underpinning, or footing replacement.",
      "broader": ["housing.rehabilitation"],
      "narrower": [],
      "aliases": ["foundation repair", "underpinning"],
      "jurisdiction": null,
      "sourceCitation": null,
      "lifecycleStatus": "active",
      "deprecatedAfter": null,
      "regulatoryStatus": "descriptive_only"
    },
    {
      "code": "housing.rehabilitation.systems",
      "preferredLabel": "Building systems rehabilitation",
      "definition": "Repair or replacement of mechanical, electrical, plumbing, or HVAC systems within an existing residential building.",
      "broader": ["housing.rehabilitation"],
      "narrower": [],
      "aliases": ["HVAC replacement", "rewiring", "replumbing"],
      "jurisdiction": null,
      "sourceCitation": null,
      "lifecycleStatus": "active",
      "deprecatedAfter": null,
      "regulatoryStatus": "descriptive_only"
    },
    {
      "code": "housing.rehabilitation",
      "preferredLabel": "Housing rehabilitation (umbrella)",
      "definition": "Umbrella category for any repair, restoration, or upgrade to an existing residential building that does not change its use or footprint.",
      "broader": [],
      "narrower": [
        "housing.rehabilitation.facade",
        "housing.rehabilitation.roof",
        "housing.rehabilitation.foundation",
        "housing.rehabilitation.systems"
      ],
      "aliases": ["home repair", "property rehabilitation"],
      "jurisdiction": null,
      "sourceCitation": null,
      "lifecycleStatus": "active",
      "deprecatedAfter": null,
      "regulatoryStatus": "descriptive_only"
    },
    {
      "code": "housing.new.single_family",
      "preferredLabel": "New single-family residence",
      "definition": "Construction of a new detached single-family dwelling on a previously undeveloped or demolished parcel.",
      "broader": ["housing.new"],
      "narrower": [],
      "aliases": ["new build", "spec home"],
      "jurisdiction": null,
      "sourceCitation": null,
      "lifecycleStatus": "active",
      "deprecatedAfter": null,
      "regulatoryStatus": "descriptive_only"
    },
    {
      "code": "housing.new.accessory_dwelling",
      "preferredLabel": "Accessory dwelling unit (ADU)",
      "definition": "Construction of a secondary dwelling (in-law suite, granny flat, backyard cottage) on a parcel with an existing primary residence.",
      "broader": ["housing.new"],
      "narrower": [],
      "aliases": ["ADU", "granny flat", "in-law suite", "backyard cottage"],
      "jurisdiction": null,
      "sourceCitation": null,
      "lifecycleStatus": "active",
      "deprecatedAfter": null,
      "regulatoryStatus": "descriptive_only"
    },
    {
      "code": "housing.new",
      "preferredLabel": "New housing construction (umbrella)",
      "definition": "Umbrella category for new residential construction.",
      "broader": [],
      "narrower": ["housing.new.single_family", "housing.new.accessory_dwelling"],
      "aliases": ["new construction"],
      "jurisdiction": null,
      "sourceCitation": null,
      "lifecycleStatus": "active",
      "deprecatedAfter": null,
      "regulatoryStatus": "descriptive_only"
    },
    {
      "code": "civic.infrastructure.sidewalk",
      "preferredLabel": "Sidewalk installation or repair",
      "definition": "Construction, repair, or replacement of a pedestrian sidewalk on a public right-of-way or private property.",
      "broader": ["civic.infrastructure"],
      "narrower": [],
      "aliases": ["sidewalk repair", "sidewalk installation"],
      "jurisdiction": null,
      "sourceCitation": null,
      "lifecycleStatus": "active",
      "deprecatedAfter": null,
      "regulatoryStatus": "descriptive_only"
    },
    {
      "code": "civic.infrastructure",
      "preferredLabel": "Civic infrastructure (umbrella)",
      "definition": "Umbrella category for public-facing infrastructure work.",
      "broader": [],
      "narrower": ["civic.infrastructure.sidewalk"],
      "aliases": ["public works"],
      "jurisdiction": null,
      "sourceCitation": null,
      "lifecycleStatus": "active",
      "deprecatedAfter": null,
      "regulatoryStatus": "descriptive_only"
    },
    {
      "code": "civic.event.public_assembly",
      "preferredLabel": "Public assembly event",
      "definition": "An event open to the public, requiring temporary occupancy of a public space (park, plaza, street).",
      "broader": ["civic.event"],
      "narrower": [],
      "aliases": ["block party", "festival", "parade"],
      "jurisdiction": null,
      "sourceCitation": null,
      "lifecycleStatus": "active",
      "deprecatedAfter": null,
      "regulatoryStatus": "descriptive_only"
    },
    {
      "code": "civic.event",
      "preferredLabel": "Civic event (umbrella)",
      "definition": "Umbrella category for civic events.",
      "broader": [],
      "narrower": ["civic.event.public_assembly"],
      "aliases": ["events"],
      "jurisdiction": null,
      "sourceCitation": null,
      "lifecycleStatus": "active",
      "deprecatedAfter": null,
      "regulatoryStatus": "descriptive_only"
    },
    {
      "code": "landuse.zoning.variance",
      "preferredLabel": "Zoning variance",
      "definition": "Request for relief from a specific zoning dimensional requirement (setback, height, lot coverage).",
      "broader": ["landuse.zoning"],
      "narrower": [],
      "aliases": ["variance", "dimensional relief"],
      "jurisdiction": null,
      "sourceCitation": null,
      "lifecycleStatus": "active",
      "deprecatedAfter": null,
      "regulatoryStatus": "descriptive_only"
    },
    {
      "code": "landuse.zoning",
      "preferredLabel": "Land-use zoning (umbrella)",
      "definition": "Umbrella category for land-use zoning matters.",
      "broader": [],
      "narrower": ["landuse.zoning.variance"],
      "aliases": ["zoning"],
      "jurisdiction": null,
      "sourceCitation": null,
      "lifecycleStatus": "active",
      "deprecatedAfter": null,
      "regulatoryStatus": "descriptive_only"
    },
    {
      "code": "other.unspecified",
      "preferredLabel": "Other (uncategorised)",
      "definition": "Catch-all for activities that do not fit any other catalog row. Partner reviewers should refine the proposal into a more specific row.",
      "broader": [],
      "narrower": [],
      "aliases": ["other", "misc"],
      "jurisdiction": null,
      "sourceCitation": null,
      "lifecycleStatus": "active",
      "deprecatedAfter": null,
      "regulatoryStatus": "descriptive_only"
    }
  ]
}
